{
  "request_id": "projection_request:f10e73277a2fb5b68f07c21b",
  "profile_id": "cognitive_architecture_demo.v0",
  "profile_version": "0.2.0",
  "source_graph": {
    "graph_type": "canonical_astrology_graph",
    "graph_version": "1.3.0",
    "objects": [
      {
        "id": "natal:Sun",
        "name": "Sun",
        "object_type": "planet_or_point",
        "sign": "Libra",
        "house": 8
      },
      {
        "id": "natal:Mars",
        "name": "Mars",
        "object_type": "planet_or_point",
        "sign": "Leo",
        "house": 6
      }
    ],
    "relationships": [
      {
        "id": "aspect:Sun:Mars",
        "relationship_type": "ASPECT",
        "source_id": "natal:Sun",
        "target_id": "natal:Mars",
        "aspect": "sextile"
      }
    ]
  },
  "structural_evidence": {
    "graph_version": "1.3.0"
  },
  "source_identity": {
    "source_chart_id": "natal:chunk28",
    "source_chart_ids": [
      "natal:chunk28"
    ],
    "sensor_instance_id": "natal:chunk28"
  },
  "context": {
    "context_id": "cognitive_architecture.general.v0",
    "context_version": "0.2.0",
    "subject_scope": "individual",
    "target_domain": "cognitive_architecture_demo.v0",
    "application_context": "cognitive_architecture_demo",
    "relationship_type": null,
    "audience": "adult_general",
    "output_intent": "structured_semantic_model",
    "constraints": {},
    "parameters": {},
    "extensions": {}
  },
  "source_registries": {},
  "options": {
    "retain_unmapped_sources": true,
    "include_audit": true,
    "include_diagnostics": true,
    "unmapped_policy": "diagnostic",
    "compact_audit": false,
    "extensions": {}
  }
}
